Code,Indicator Name,Short definition,Long definition,Source,Topic,Dataset,Periodicity,Aggregation method,General comments
DT.DFR.DPPG.CD,Debt forgiveness or reduction (current US$),Debt forgiveness or reduction shows the change in debt stock due to debt forgiveness or reduction. It is derived by subtracting debt forgiven and debt stock reduction from debt buyback. Data are in current U.S. dollars.,Debt forgiveness or reduction shows the change in debt stock due to debt forgiveness or reduction. It is derived by subtracting debt forgiven and debt stock reduction from debt buyback. Data are in current U.S. dollars.,"World Bank, International Debt Statistics.","Economic Policy & Debt: External debt: Arrears, reschedulings, etc.",International Debt Statistics,Annual,Sum,
DT.DOD.MDRI.CD,Debt forgiveness grants (current US$),Debt forgiveness grants data cover both debt cancelled by agreement between debtor and creditor and a reduction in the net present value of non-ODA debt achieved by concessional rescheduling or refinancing. The  data are on a disbursement basis and cover flows from all bilateral and multilateral donors. Data are in current U.S. dollars.,Debt forgiveness grants data cover both debt cancelled by agreement between debtor and creditor and a reduction in the net present value of non-ODA debt achieved by concessional rescheduling or refinancing. The  data are on a disbursement basis and cover flows from all bilateral and multilateral donors. Data are in current U.S. dollars.,Development Assistance Committee of the Organisation for Economic Co-operation and Development.,Economic Policy & Debt: Official development assistance,International Debt Statistics,Annual,Sum,The aggregate figure for all developing countries is sourced from OECD and includes all OECD countries and regions.
BN.CAB.XOKA.CD,Current account balance (current US$),"Current account balance shows the difference between the sum of exports and income receivable and the sum of imports and income payable (exports and imports refer to both goods and services, while income refers to both primary and secondary income).","Current account balance shows the difference between the sum of exports and income receivable and the sum of imports and income payable (exports and imports refer to both goods and services, while income refers to both primary and secondary income).","International Monetary Fund, Balance of Payments Statistics Yearbook.",Economic Policy & Debt: Balance of payments: Current account: Balances,International Debt Statistics,Annual,Sum,
DT.TDS.DECT.EX.ZS,"Total debt service (% of exports of goods, services and primary income)","Total debt service to exports of goods, services and primary income. Total debt service is the sum of principal repayments and interest actually paid in currency, goods, or services on long-term debt, interest paid on short-term debt, and repayments (repurchases and charges) to the IMF.","Total debt service to exports of goods, services and primary income. Total debt service is the sum of principal repayments and interest actually paid in currency, goods, or services on long-term debt, interest paid on short-term debt, and repayments (repurchases and charges) to the IMF.","World Bank, International Debt Statistics.",Economic Policy & Debt: External debt: Debt ratios & other items,International Debt Statistics,Annual,Weighted average,The denominator for this indicator in previous versions of Global Development Finance included workers' remittances. Workers' remittances are no longer included.
DT.TXR.DPPG.CD,Total amount of debt rescheduled (current US$),"Total amount of debt rescheduled includes the debt stock, principal, interest, charges and penalties rescheduled. Data are in current U.S. dollars.","Total amount of debt rescheduled includes the debt stock, principal, interest, charges and penalties rescheduled. Data are in current U.S. dollars.","World Bank, International Debt Statistics.","Economic Policy & Debt: External debt: Arrears, reschedulings, etc.",International Debt Statistics,Annual,Sum,
DT.DOD.DSTC.ZS,Short-term debt (% of total external debt),"Short-term debt includes all debt having an original maturity of one year or less and interest in arrears on long-term debt. Total external debt is debt owed to nonresidents repayable in currency, goods, or services. Total external debt is the sum of public, publicly guaranteed, and private nonguaranteed long-term debt, use of IMF credit, and short-term debt.","Short-term debt includes all debt having an original maturity of one year or less and interest in arrears on long-term debt. Total external debt is debt owed to nonresidents repayable in currency, goods, or services. Total external debt is the sum of public, publicly guaranteed, and private nonguaranteed long-term debt, use of IMF credit, and short-term debt.","World Bank, International Debt Statistics.",Economic Policy & Debt: External debt: Debt ratios & other items,International Debt Statistics,Annual,Weighted average,
DT.AXF.DPPG.CD,Principal forgiven (current US$),"Principal forgiven is the amount of principal due or in arrears that was written off or forgiven in any given year. It includes debt forgiven within and outside Paris Club agreements, principal forgiven and principal arrears forgiven. Data are in current U.S. dollars.","Principal forgiven is the amount of principal due or in arrears that was written off or forgiven in any given year. It includes debt forgiven within and outside Paris Club agreements, principal forgiven and principal arrears forgiven. Data are in current U.S. dollars.","World Bank, International Debt Statistics.","Economic Policy & Debt: External debt: Arrears, reschedulings, etc.",International Debt Statistics,Annual,Sum,
DT.AMT.DECB.CD,,"Central bank  long-term debt are aggregated. The central bank is the financial institution (or institutions) that exercises control over key aspects of the financial system. The monetary authority, normally the agency that issues currency and holds the country’s international reserves. Principal repayments are actual amounts of principal (amortization) paid by the borrower in currency, goods, or services in the year specified. Long-term external debt is defined as debt that has an original or extended maturity of more than one year and that is owed to nonresidents by residents of an economy and repayable in currency, goods, or services. Data are in current U.S. dollars.","Central bank  long-term debt are aggregated. The central bank is the financial institution (or institutions) that exercises control over key aspects of the financial system. The monetary authority, normally the agency that issues currency and holds the country’s international reserves.  Principal repayments are actual amounts of principal (amortization) paid by the borrower in currency, goods, or services in the year specified. Long-term external debt is defined as debt that has an original or extended maturity of more than one year and that is owed to nonresidents by residents of an economy and repayable in currency, goods, or services. Data are in current U.S. dollars.","World Bank, International Debt Statistics.",Economic Policy & Debt: External debt: Amortization,,Annual,,
DT.INR.DPPG,Average interest on new external debt commitments (%),"Interest represents the average interest rate on all new public and publicly guaranteed loans contracted during the year. To obtain the average, the interest rates for all public and publicly guaranteed loans have been weighted by the amounts of the loans. Public debt is an external obligation of a public debtor, including the national government, a political subdivision (or an agency of either), and autonomous public bodies. Publicly guaranteed debt is an external obligation of a private debtor that is guaranteed for repayment by a public entity.","Interest represents the average interest rate on all new public and publicly guaranteed loans contracted during the year. To obtain the average, the interest rates for all public and publicly guaranteed loans have been weighted by the amounts of the loans. Public debt is an external obligation of a public debtor, including the national government, a political subdivision (or an agency of either), and autonomous public bodies. Publicly guaranteed debt is an external obligation of a private debtor that is guaranteed for repayment by a public entity.","World Bank, International Debt Statistics.",Economic Policy & Debt: External debt: Terms,International Debt Statistics,Annual,Weighted average,
DT.GRE.DPPG,Average grant element on new external debt commitments (%),"The grant element of a loan is the grant equivalent expressed as a percentage of the amount committed. It is used as a measure of the overall cost of borrowing. To obtain the average, the grant elements for all public and publicly guaranteed loans have been weighted by the amounts of the loans. The grant equivalent of a loan is its commitment (present) value, less the discounted present value of its contractual debt service; conventionally, future service payments are discounted at 10 percent. Commitments cover the total amount of loans for which contracts were signed in the year specified. Public debt is an external obligation of a public debtor, including the national government, a political subdivision (or an agency of either), and autonomous public bodies. Publicly guaranteed debt is an external obligation of a private debtor that is guaranteed for repayment by a public entity. Data for private nonguaranteed debt are not available.","The grant element of a loan is the grant equivalent expressed as a percentage of the amount committed. It is used as a measure of the overall cost of borrowing. To obtain the average, the grant elements for all public and publicly guaranteed loans have been weighted by the amounts of the loans. The grant equivalent of a loan is its commitment (present) value, less the discounted present value of its contractual debt service; conventionally, future service payments are discounted at 10 percent. Commitments cover the total amount of loans for which contracts were signed in the year specified. Public debt is an external obligation of a public debtor, including the national government, a political subdivision (or an agency of either), and autonomous public bodies. Publicly guaranteed debt is an external obligation of a private debtor that is guaranteed for repayment by a public entity. Data for private nonguaranteed debt are not available.","World Bank, International Debt Statistics.",Economic Policy & Debt: External debt: Terms,International Debt Statistics,Annual,Weighted average,
DT.GPA.DPPG,Average grace period on new external debt commitments (years),"Grace period is the period from the date of signature of the loan or the issue of the financial instrument to the first repayment of principal. To obtain the average, the grace periods for all public and publicly guaranteed loans have been weighted by the amounts of the loans. Public debt is an external obligation of a public debtor, including the national government, a political subdivision (or an agency of either), and autonomous public bodies. Publicly guaranteed debt is an external obligation of a private debtor that is guaranteed for repayment by a public entity.","Grace period is the period from the date of signature of the loan or the issue of the financial instrument to the first repayment of principal. To obtain the average, the grace periods for all public and publicly guaranteed loans have been weighted by the amounts of the loans. Public debt is an external obligation of a public debtor, including the national government, a political subdivision (or an agency of either), and autonomous public bodies. Publicly guaranteed debt is an external obligation of a private debtor that is guaranteed for repayment by a public entity.","World Bank, International Debt Statistics.",Economic Policy & Debt: External debt: Terms,International Debt Statistics,Annual,Weighted average,
DT.MAT.DPPG,Average maturity on new external debt commitments (years),"Maturity is the number of years to original maturity date, which is the sum of grace and repayment periods. Grace period for principal is the period from the date of signature of the loan or the issue of the financial instrument to the first repayment of principal. The repayment period is the period from the first to last repayment of principal. To obtain the average, the maturity for all public and publicly guaranteed loans have been weighted by the amounts of the loans. Public debt is an external obligation of a public debtor, including the national government, a political subdivision (or an agency of either), and autonomous public bodies. Publicly guaranteed debt is an external obligation of a private debtor that is guaranteed for repayment by a public entity.","Maturity is the number of years to original maturity date, which is the sum of grace and repayment periods. Grace period for principal is the period from the date of signature of the loan or the issue of the financial instrument to the first repayment of principal. The repayment period is the period from the first to last repayment of principal. To obtain the average, the maturity for all public and publicly guaranteed loans have been weighted by the amounts of the loans. Public debt is an external obligation of a public debtor, including the national government, a political subdivision (or an agency of either), and autonomous public bodies. Publicly guaranteed debt is an external obligation of a private debtor that is guaranteed for repayment by a public entity.","World Bank, International Debt Statistics.",Economic Policy & Debt: External debt: Terms,International Debt Statistics,Annual,Weighted average,
DT.DOD.ALLC.ZS,Concessional debt (% of total external debt),Concessional debt to total external debt stocks. Concessional debt is defined as loans with an original grant element of 35 percent or more.,Concessional debt to total external debt stocks. Concessional debt is defined as loans with an original grant element of 35 percent or more.,"World Bank, International Debt Statistics.",Economic Policy & Debt: External debt: Debt ratios & other items,International Debt Statistics,Annual,Weighted average,
DT.CUR.OTHC.ZS,"Currency composition of PPG debt, all other currencies (%)",The percentage of external long-term public and publicly-guaranteed debt contracted in all other currencies not specified for the low- and middle-income countries.,The percentage of external long-term public and publicly-guaranteed debt contracted in all other currencies not specified for the low- and middle-income countries.,"World Bank, International Debt Statistics.",Economic Policy & Debt: External debt: Currency composition,International Debt Statistics,Annual,Weighted average,
DT.CUR.DMAK.ZS,"Currency composition of PPG debt, Deutsche mark (%)",The percentage of external long-term public and publicly-guaranteed debt contracted in Deutsche marks for the low- and middle-income countries.,The percentage of external long-term public and publicly-guaranteed debt contracted in Deutsche marks for the low- and middle-income countries.,"World Bank, International Debt Statistics.",Economic Policy & Debt: External debt: Currency composition,International Debt Statistics,Annual,Weighted average,
DT.CUR.EURO.ZS,"Currency composition of PPG debt, Euro (%)",The percentage of external long-term public and publicly-guaranteed debt contracted in Euros for the low- and middle-income countries.,The percentage of external long-term public and publicly-guaranteed debt contracted in Euros for the low- and middle-income countries.,"World Bank, International Debt Statistics.",Economic Policy & Debt: External debt: Currency composition,International Debt Statistics,Annual,Weighted average,
DT.CUR.FFRC.ZS,"Currency composition of PPG debt, French franc (%)",The percentage of external long-term public and publicly-guaranteed debt contracted in French francs for the low- and middle-income countries.,The percentage of external long-term public and publicly-guaranteed debt contracted in French francs for the low- and middle-income countries.,"World Bank, International Debt Statistics.",Economic Policy & Debt: External debt: Currency composition,International Debt Statistics,Annual,Weighted average,
DT.CUR.JYEN.ZS,"Currency composition of PPG debt, Japanese yen (%)",The percentage of external long-term public and publicly-guaranteed debt contracted in Japanese yen for the low- and middle-income countries.,The percentage of external long-term public and publicly-guaranteed debt contracted in Japanese yen for the low- and middle-income countries.,"World Bank, International Debt Statistics.",Economic Policy & Debt: External debt: Currency composition,International Debt Statistics,Annual,Weighted average,
DT.CUR.MULC.ZS,"Currency composition of PPG debt, Multiple currencies (%)",The percentage of external long-term public and publicly-guaranteed debt contracted in multiple currencies for the low- and middle-income countries.,The percentage of external long-term public and publicly-guaranteed debt contracted in multiple currencies for the low- and middle-income countries.,"World Bank, International Debt Statistics.",Economic Policy & Debt: External debt: Currency composition,International Debt Statistics,Annual,Weighted average,
DT.CUR.UKPS.ZS,"Currency composition of PPG debt, Pound sterling (%)",The percentage of external long-term public and publicly-guaranteed debt contracted in U.K. pound sterling for the low- and middle-income countries.,The percentage of external long-term public and publicly-guaranteed debt contracted in U.K. pound sterling for the low- and middle-income countries.,"World Bank, International Debt Statistics.",Economic Policy & Debt: External debt: Currency composition,International Debt Statistics,Annual,Weighted average,
DT.CUR.SDRW.ZS,"Currency composition of PPG debt, SDR (%)",The percentage of external long-term public and publicly-guaranteed debt contracted in special drawing rights for the low- and middle-income countries.,The percentage of external long-term public and publicly-guaranteed debt contracted in special drawing rights for the low- and middle-income countries.,"World Bank, International Debt Statistics.",Economic Policy & Debt: External debt: Currency composition,International Debt Statistics,Annual,Weighted average,
DT.CUR.SWFR.ZS,"Currency composition of PPG debt, Swiss franc (%)",The percentage of external long-term public and publicly-guaranteed debt contracted in Swiss francs for the low- and middle-income countries.,The percentage of external long-term public and publicly-guaranteed debt contracted in Swiss francs for the low- and middle-income countries.,"World Bank, International Debt Statistics.",Economic Policy & Debt: External debt: Currency composition,International Debt Statistics,Annual,Weighted average,
DT.CUR.USDL.ZS,"Currency composition of PPG debt, U.S. dollars (%)",The percentage of external long-term public and publicly-guaranteed debt contracted in U.S. dollars for the low- and middle-income countries.,The percentage of external long-term public and publicly-guaranteed debt contracted in U.S. dollars for the low- and middle-income countries.,"World Bank, International Debt Statistics.",Economic Policy & Debt: External debt: Currency composition,International Debt Statistics,Annual,Weighted average,
DT.DIS.DLXF.CD,"Disbursements on external debt, long-term (DIS, current US$)","Disbursements on long-term debt are drawings by the borrower on loan commitments during the year specified. Long-term external debt is defined as debt that has an original or extended maturity of more than one year and that is owed to nonresidents by residents of an economy and repayable in currency, goods, or services. Data are in current U.S. dollars.","Disbursements on long-term debt are drawings by the borrower on loan commitments during the year specified. Long-term external debt is defined as debt that has an original or extended maturity of more than one year and that is owed to nonresidents by residents of an economy and repayable in currency, goods, or services. Data are in current U.S. dollars.","World Bank, International Debt Statistics.",Economic Policy & Debt: External debt: Disbursements,International Debt Statistics,Annual,Sum,
DT.DIS.DEGG.CD,"Disbursements on external debt, general government sector (PPG) (DIS, current US$)","General government long-term debt are aggregated. Public debt is an external obligation of a public debtor, including the national government, a political subdivision (or an agency of either), and autonomous public bodies. Publicly guaranteed debt is an external obligation of a private debtor that is guaranteed for repayment by a public entity. Disbursements are drawings by the borrower on loan commitments during the year specified. Long-term external debt is defined as debt that has an original or extended maturity of more than one year and that is owed to nonresidents by residents of an economy and repayable in currency, goods, or services. Data are in current U.S. dollars.","General government long-term debt are aggregated. Public debt is an external obligation of a public debtor, including the national government, a political subdivision (or an agency of either), and autonomous public bodies. Publicly guaranteed debt is an external obligation of a private debtor that is guaranteed for repayment by a public entity. Disbursements are drawings by the borrower on loan commitments during the year specified. Long-term external debt is defined as debt that has an original or extended maturity of more than one year and that is owed to nonresidents by residents of an economy and repayable in currency, goods, or services. Data are in current U.S. dollars.","World Bank, International Debt Statistics.",Economic Policy & Debt: External debt: Disbursements,International Debt Statistics,Annual,Sum,
DT.UND.DPPG.CD,"Undisbursed external debt, total (UND, current US$)","Undisbursed debt is the total public and publicly guaranteed debt undrawn at year end; data for private nonguaranteed debt are not available. Public and publicly guaranteed long-term debt are aggregated. Public debt is an external obligation of a public debtor, including the national government, a political subdivision (or an agency of either), and autonomous public bodies. Publicly guaranteed debt is an external obligation of a private debtor that is guaranteed for repayment by a public entity. Data are in current U.S. dollars.","Undisbursed debt is the total public and publicly guaranteed debt undrawn at year end; data for private nonguaranteed debt are not available. Public and publicly guaranteed long-term debt are aggregated. Public debt is an external obligation of a public debtor, including the national government, a political subdivision (or an agency of either), and autonomous public bodies. Publicly guaranteed debt is an external obligation of a private debtor that is guaranteed for repayment by a public entity. Data are in current U.S. dollars.","World Bank, International Debt Statistics.",Economic Policy & Debt: External debt: Undisbursed debt,International Debt Statistics,Annual,Sum,
FI.RES.TOTL.DT.ZS,Total reserves (% of total external debt),International reserves to total external debt stocks.,International reserves to total external debt stocks.,"World Bank, International Debt Statistics.",Economic Policy & Debt: Balance of payments: Reserves & other items,International Debt Statistics,Annual,Weighted average,
