Code,Indicator Name,Short definition,Long definition,Source,Topic,Dataset,Periodicity,Aggregation method,General comments
DT.AMT.DEGG.CD,"Principal repayments on external debt, general government sector (PPG) (AMT, current US$)","General government long-term debt are aggregated. General government debt is an external obligation of a public debtor, including the national government, a political subdivision (or an agency of either), and autonomous public bodies. Publicly guaranteed debt is an external obligation of a private debtor that is guaranteed for repayment by a public entity. Principal repayments are actual amounts of principal (amortization) paid by the borrower in currency, goods, or services in the year specified. Long-term external debt is defined as debt that has an original or extended maturity of more than one year and that is owed to nonresidents by residents of an economy and repayable in currency, goods, or services. Data are in current U.S. dollars.","General government long-term debt are aggregated. General government debt is an external obligation of a public debtor, including the national government, a political subdivision (or an agency of either), and autonomous public bodies. Publicly guaranteed debt is an external obligation of a private debtor that is guaranteed for repayment by a public entity. Principal repayments are actual amounts of principal (amortization) paid by the borrower in currency, goods, or services in the year specified. Long-term external debt is defined as debt that has an original or extended maturity of more than one year and that is owed to nonresidents by residents of an economy and repayable in currency, goods, or services. Data are in current U.S. dollars.","World Bank, International Debt Statistics.",Economic Policy & Debt: External debt: Amortization,International Debt Statistics,Annual,Sum,
DT.AMT.DLXF.CD,"Principal repayments on external debt, long-term (AMT, current US$)","Principal repayments on long-term debt are actual amounts of principal (amortization) paid by the borrower in currency, goods, or services in the year specified. Long-term external debt is defined as debt that has an original or extended maturity of more than one year and that is owed to nonresidents by residents of an economy and repayable in currency, goods, or services. Data are in current U.S. dollars.","Principal repayments on long-term debt are actual amounts of principal (amortization) paid by the borrower in currency, goods, or services in the year specified. Long-term external debt is defined as debt that has an original or extended maturity of more than one year and that is owed to nonresidents by residents of an economy and repayable in currency, goods, or services. Data are in current U.S. dollars.","World Bank, International Debt Statistics.",Economic Policy & Debt: External debt: Amortization,International Debt Statistics,Annual,Sum,
DT.AMT.DLTF.CD,"Principal repayments on external debt, long-term + IMF (AMT, current US$)","Principal repayments are actual amounts of principal (amortization) paid by the borrower in currency, goods, or services in the year specified. This item includes principal repayments on long-term debt and IMF repurchases. Long-term external debt is defined as debt that has an original or extended maturity of more than one year and that is owed to nonresidents by residents of an economy and repayable in currency, goods, or services. IMF repurchases are total repayments of outstanding drawings from the General Resources Account during the year specified, excluding repayments due in the reserve tranche. To maintain comparability between data on transactions with the IMF and data on long-term debt, use of IMF credit outstanding at the end of year (stock) is converted to dollars at the SDR exchange rate in effect at the end of year. Repurchases (flows) are converted at the average SDR exchange rate for the year in which transactions take place. Data are in current U.S. dollars.","Principal repayments are actual amounts of principal (amortization) paid by the borrower in currency, goods, or services in the year specified. This item includes principal repayments on long-term debt and IMF repurchases. Long-term external debt is defined as debt that has an original or extended maturity of more than one year and that is owed to nonresidents by residents of an economy and repayable in currency, goods, or services. IMF repurchases are total repayments of outstanding drawings from the General Resources Account during the year specified, excluding repayments due in the reserve tranche. To maintain comparability between data on transactions with the IMF and data on long-term debt, use of IMF credit outstanding at the end of year (stock) is converted to dollars at the SDR exchange rate in effect at the end of year. Repurchases (flows) are converted at the average SDR exchange rate for the year in which transactions take place. Data are in current U.S. dollars.","World Bank, International Debt Statistics.",Economic Policy & Debt: External debt: Amortization,International Debt Statistics,Annual,Sum,
DT.AMT.DOPS.CD,"Principal repayments on external debt, other public sector (PPG) (AMT, current US$)","Other public sector long-term debt are aggregated. Other public sector debt is an external obligation of a public debtor, including the national government, a political subdivision (or an agency of either), and autonomous public bodies. Publicly guaranteed debt is an external obligation of a private debtor that is guaranteed for repayment by a public entity. Principal repayments are actual amounts of principal (amortization) paid by the borrower in currency, goods, or services in the year specified. Long-term external debt is defined as debt that has an original or extended maturity of more than one year and that is owed to nonresidents by residents of an economy and repayable in currency, goods, or services. Data are in current U.S. dollars.","Other public sector long-term debt are aggregated. Other public sector debt is an external obligation of a public debtor, including the national government, a political subdivision (or an agency of either), and autonomous public bodies. Publicly guaranteed debt is an external obligation of a private debtor that is guaranteed for repayment by a public entity. Principal repayments are actual amounts of principal (amortization) paid by the borrower in currency, goods, or services in the year specified. Long-term external debt is defined as debt that has an original or extended maturity of more than one year and that is owed to nonresidents by residents of an economy and repayable in currency, goods, or services. Data are in current U.S. dollars.","World Bank, International Debt Statistics.",Economic Policy & Debt: External debt: Amortization,International Debt Statistics,Annual,Sum,
DT.AMT.PRPG.CD,"Principal repayments on external debt, private guaranteed by public sector (PPG) (AMT, current US$)","Private sector guaranteed by Public Sector  long-term debt are aggregated.Private sector guaranteed by Public Sector debt is an external obligation of a public debtor, including the national government, a political subdivision (or an agency of either), and autonomous public bodies. Publicly guaranteed debt is an external obligation of a private debtor that is guaranteed for repayment by a public entity. Principal repayments are actual amounts of principal (amortization) paid by the borrower in currency, goods, or services in the year specified. Long-term external debt is defined as debt that has an original or extended maturity of more than one year and that is owed to nonresidents by residents of an economy and repayable in currency, goods, or services. Data are in current U.S. dollars.","Private sector guaranteed by Public Sector  long-term debt are aggregated.Private sector guaranteed by Public Sector debt is an external obligation of a public debtor, including the national government, a political subdivision (or an agency of either), and autonomous public bodies. Publicly guaranteed debt is an external obligation of a private debtor that is guaranteed for repayment by a public entity. Principal repayments are actual amounts of principal (amortization) paid by the borrower in currency, goods, or services in the year specified. Long-term external debt is defined as debt that has an original or extended maturity of more than one year and that is owed to nonresidents by residents of an economy and repayable in currency, goods, or services. Data are in current U.S. dollars.","World Bank, International Debt Statistics.",Economic Policy & Debt: External debt: Amortization,International Debt Statistics,Annual,Sum,
DT.AMT.DPNG.CD,"Principal repayments on external debt, private nonguaranteed (PNG) (AMT, current US$)","Private nonguaranteed external debt is an external obligation of a private debtor that is not guaranteed for repayment by a public entity. Principal repayments are actual amounts of principal (amortization) paid by the borrower in currency, goods, or services in the year specified. Long-term external debt is defined as debt that has an original or extended maturity of more than one year and that is owed to nonresidents by residents of an economy and repayable in currency, goods, or services. Data are in current U.S. dollars.","Private nonguaranteed external debt is an external obligation of a private debtor that is not guaranteed for repayment by a public entity. Principal repayments are actual amounts of principal (amortization) paid by the borrower in currency, goods, or services in the year specified. Long-term external debt is defined as debt that has an original or extended maturity of more than one year and that is owed to nonresidents by residents of an economy and repayable in currency, goods, or services. Data are in current U.S. dollars.","World Bank, International Debt Statistics.",Economic Policy & Debt: External debt: Amortization,International Debt Statistics,Annual,Sum,
DT.AMT.DPPG.CD,"Principal repayments on external debt, public and publicly guaranteed (PPG) (AMT, current US$)","Public and publicly guaranteed long-term debt are aggregated. Public debt is an external obligation of a public debtor, including the national government, a political subdivision (or an agency of either), and autonomous public bodies. Publicly guaranteed debt is an external obligation of a private debtor that is guaranteed for repayment by a public entity. Principal repayments are actual amounts of principal (amortization) paid by the borrower in currency, goods, or services in the year specified. Long-term external debt is defined as debt that has an original or extended maturity of more than one year and that is owed to nonresidents by residents of an economy and repayable in currency, goods, or services. Data are in current U.S. dollars.","Public and publicly guaranteed long-term debt are aggregated. Public debt is an external obligation of a public debtor, including the national government, a political subdivision (or an agency of either), and autonomous public bodies. Publicly guaranteed debt is an external obligation of a private debtor that is guaranteed for repayment by a public entity. Principal repayments are actual amounts of principal (amortization) paid by the borrower in currency, goods, or services in the year specified. Long-term external debt is defined as debt that has an original or extended maturity of more than one year and that is owed to nonresidents by residents of an economy and repayable in currency, goods, or services. Data are in current U.S. dollars.","World Bank, International Debt Statistics.",Economic Policy & Debt: External debt: Amortization,International Debt Statistics,Annual,Sum,
DT.AMT.DEPS.CD,"Principal repayments on external debt, public sector (PPG) (AMT, current US$)","Public sector long-term debt are aggregated. Public sector debt is an external obligation of a public debtor, including the national government, a political subdivision (or an agency of either), and autonomous public bodies. Publicly guaranteed debt is an external obligation of a private debtor that is guaranteed for repayment by a public entity. Principal repayments are actual amounts of principal (amortization) paid by the borrower in currency, goods, or services in the year specified. Long-term external debt is defined as debt that has an original or extended maturity of more than one year and that is owed to nonresidents by residents of an economy and repayable in currency, goods, or services. Data are in current U.S. dollars.","Public sector long-term debt are aggregated. Public sector debt is an external obligation of a public debtor, including the national government, a political subdivision (or an agency of either), and autonomous public bodies. Publicly guaranteed debt is an external obligation of a private debtor that is guaranteed for repayment by a public entity. Principal repayments are actual amounts of principal (amortization) paid by the borrower in currency, goods, or services in the year specified. Long-term external debt is defined as debt that has an original or extended maturity of more than one year and that is owed to nonresidents by residents of an economy and repayable in currency, goods, or services. Data are in current U.S. dollars.","World Bank, International Debt Statistics.",Economic Policy & Debt: External debt: Amortization,International Debt Statistics,Annual,Sum,
DT.AXR.DPPG.CD,Principal rescheduled (current US$),Principal rescheduled is the amount of principal due or in arrears that was rescheduled in any given year. Data are in current U.S. dollars.,Principal rescheduled is the amount of principal due or in arrears that was rescheduled in any given year. Data are in current U.S. dollars.,"World Bank, International Debt Statistics.","Economic Policy & Debt: External debt: Arrears, reschedulings, etc.",International Debt Statistics,Annual,Sum,
DT.AXR.OFFT.CD,"Principal rescheduled, official (current US$)","Principal rescheduled is the amount of principal due or in arrears that was rescheduled in any given year. Debt from official creditors includes loans from international organizations (multilateral loans) and loans from governments (bilateral loans). Loans from international organization include loans and credits from the World Bank, regional development banks, and other multilateral and intergovernmental agencies. Excluded are loans from funds administered by an international organization on behalf of a single donor government; these are classified as loans from governments. Government loans include loans from governments and their agencies (including central banks), loans from autonomous bodies, and direct loans from official export credit agencies. Data are in current U.S. dollars.","Principal rescheduled is the amount of principal due or in arrears that was rescheduled in any given year. Debt from official creditors includes loans from international organizations (multilateral loans) and loans from governments (bilateral loans). Loans from international organization include loans and credits from the World Bank, regional development banks, and other multilateral and intergovernmental agencies. Excluded are loans from funds administered by an international organization on behalf of a single donor government; these are classified as loans from governments. Government loans include loans from governments and their agencies (including central banks), loans from autonomous bodies, and direct loans from official export credit agencies. Data are in current U.S. dollars.","World Bank, International Debt Statistics.","Economic Policy & Debt: External debt: Arrears, reschedulings, etc.",International Debt Statistics,Annual,Sum,
DT.AXR.PRVT.CD,"Principal rescheduled, private (current US$)","Principal rescheduled is the amount of principal due or in arrears that was rescheduled in any given year. Debt from private creditors include bonds that are either publicly issued or privately placed; commercial bank loans from private banks and other private financial institutions; and other private credits from manufacturers, exporters, and other suppliers of goods, and bank credits covered by a guarantee of an export credit agency. Data are in current U.S. dollars.","Principal rescheduled is the amount of principal due or in arrears that was rescheduled in any given year. Debt from private creditors include bonds that are either publicly issued or privately placed; commercial bank loans from private banks and other private financial institutions; and other private credits from manufacturers, exporters, and other suppliers of goods, and bank credits covered by a guarantee of an export credit agency. Data are in current U.S. dollars.","World Bank, International Debt Statistics.","Economic Policy & Debt: External debt: Arrears, reschedulings, etc.",International Debt Statistics,Annual,Sum,
DT.DOD.DSTC.ZS,Short-term debt (% of total external debt),"Short-term debt includes all debt having an original maturity of one year or less and interest in arrears on long-term debt. Total external debt is debt owed to nonresidents repayable in currency, goods, or services. Total external debt is the sum of public, publicly guaranteed, and private nonguaranteed long-term debt, use of IMF credit, and short-term debt.","Short-term debt includes all debt having an original maturity of one year or less and interest in arrears on long-term debt. Total external debt is debt owed to nonresidents repayable in currency, goods, or services. Total external debt is the sum of public, publicly guaranteed, and private nonguaranteed long-term debt, use of IMF credit, and short-term debt.","World Bank, International Debt Statistics.",Economic Policy & Debt: External debt: Debt ratios & other items,International Debt Statistics,Annual,Weighted average,
BX.GRT.TECH.CD.DT,Technical cooperation grants (current US$),"Technical cooperation grants include free-standing technical cooperation grants, which are intended to finance the transfer of technical and managerial skills or of technology for the purpose of building up general national capacity without reference to any specific investment projects; and investment-related technical cooperation grants, which are provided to strengthen the capacity to execute specific investment projects. Data are in current U.S. dollars.","Technical cooperation grants include free-standing technical cooperation grants, which are intended to finance the transfer of technical and managerial skills or of technology for the purpose of building up general national capacity without reference to any specific investment projects; and investment-related technical cooperation grants, which are provided to strengthen the capacity to execute specific investment projects. Data are in current U.S. dollars.","World Bank, International Debt Statistics.",Economic Policy & Debt: Balance of payments: Reserves & other items,International Debt Statistics,Annual,Sum,
DT.TXR.DPPG.CD,Total amount of debt rescheduled (current US$),"Total amount of debt rescheduled includes the debt stock, principal, interest, charges and penalties rescheduled. Data are in current U.S. dollars.","Total amount of debt rescheduled includes the debt stock, principal, interest, charges and penalties rescheduled. Data are in current U.S. dollars.","World Bank, International Debt Statistics.","Economic Policy & Debt: External debt: Arrears, reschedulings, etc.",International Debt Statistics,Annual,Sum,
DT.DOD.DECT.CD.CG,Total change in external debt stocks (current US$),Total change in debt stocks shows the variation in debt stock between two consecutive years. Data are in current U.S. dollars.,Total change in debt stocks shows the variation in debt stock between two consecutive years. Data are in current U.S. dollars.,"World Bank, International Debt Statistics.","Economic Policy & Debt: External debt: Arrears, reschedulings, etc.",International Debt Statistics,Annual,Sum,
FI.RES.TOTL.DT.ZS,Total reserves (% of total external debt),International reserves to total external debt stocks.,International reserves to total external debt stocks.,"World Bank, International Debt Statistics.",Economic Policy & Debt: Balance of payments: Reserves & other items,International Debt Statistics,Annual,Weighted average,
FI.RES.TOTL.CD,"Total reserves (includes gold, current US$)","Total reserves comprise holdings of monetary gold, special drawing rights, reserves of IMF members held by the IMF, and holdings of foreign exchange under the control of monetary authorities. The gold component of these reserves is valued at year-end (December 31) London prices. Data are in current U.S. dollars.","Total reserves comprise holdings of monetary gold, special drawing rights, reserves of IMF members held by the IMF, and holdings of foreign exchange under the control of monetary authorities. The gold component of these reserves is valued at year-end (December 31) London prices. Data are in current U.S. dollars.","International Monetary Fund, International Financial Statistics.",Economic Policy & Debt: Balance of payments: Reserves & other items,International Debt Statistics,Annual,Sum,
DT.UND.OFFT.CD,"Undisbursed external debt, official creditors (UND, current US$)","Undisbursed debt is the total public and publicly guaranteed debt undrawn at year end; data for private nonguaranteed debt are not available. Debt from official creditors includes loans from international organizations (multilateral loans) and loans from governments (bilateral loans). Loans from international organization include loans and credits from the World Bank, regional development banks, and other multilateral and intergovernmental agencies. Excluded are loans from funds administered by an international organization on behalf of a single donor government; these are classified as loans from governments. Government loans include loans from governments and their agencies (including central banks), loans from autonomous bodies, and direct loans from official export credit agencies. Data are in current U.S. dollars.","Undisbursed debt is the total public and publicly guaranteed debt undrawn at year end; data for private nonguaranteed debt are not available. Debt from official creditors includes loans from international organizations (multilateral loans) and loans from governments (bilateral loans). Loans from international organization include loans and credits from the World Bank, regional development banks, and other multilateral and intergovernmental agencies. Excluded are loans from funds administered by an international organization on behalf of a single donor government; these are classified as loans from governments. Government loans include loans from governments and their agencies (including central banks), loans from autonomous bodies, and direct loans from official export credit agencies. Data are in current U.S. dollars.","World Bank, International Debt Statistics.",Economic Policy & Debt: External debt: Undisbursed debt,International Debt Statistics,Annual,Sum,
DT.UND.PRVT.CD,"Undisbursed external debt, private creditors (UND, current US$)","Undisbursed debt is the total public and publicly guaranteed debt undrawn at year end; data for private nonguaranteed debt are not available. Debt from private creditors include bonds that are either publicly issued or privately placed; commercial bank loans from private banks and other private financial institutions; and other private credits from manufacturers, exporters, and other suppliers of goods, and bank credits covered by a guarantee of an export credit agency. Data are in current U.S. dollars.","Undisbursed debt is the total public and publicly guaranteed debt undrawn at year end; data for private nonguaranteed debt are not available. Debt from private creditors include bonds that are either publicly issued or privately placed; commercial bank loans from private banks and other private financial institutions; and other private credits from manufacturers, exporters, and other suppliers of goods, and bank credits covered by a guarantee of an export credit agency. Data are in current U.S. dollars.","World Bank, International Debt Statistics.",Economic Policy & Debt: External debt: Undisbursed debt,International Debt Statistics,Annual,Sum,
DT.UND.DPPG.CD,"Undisbursed external debt, total (UND, current US$)","Undisbursed debt is the total public and publicly guaranteed debt undrawn at year end; data for private nonguaranteed debt are not available. Public and publicly guaranteed long-term debt are aggregated. Public debt is an external obligation of a public debtor, including the national government, a political subdivision (or an agency of either), and autonomous public bodies. Publicly guaranteed debt is an external obligation of a private debtor that is guaranteed for repayment by a public entity. Data are in current U.S. dollars.","Undisbursed debt is the total public and publicly guaranteed debt undrawn at year end; data for private nonguaranteed debt are not available. Public and publicly guaranteed long-term debt are aggregated. Public debt is an external obligation of a public debtor, including the national government, a political subdivision (or an agency of either), and autonomous public bodies. Publicly guaranteed debt is an external obligation of a private debtor that is guaranteed for repayment by a public entity. Data are in current U.S. dollars.","World Bank, International Debt Statistics.",Economic Policy & Debt: External debt: Undisbursed debt,International Debt Statistics,Annual,Sum,
