Code,Indicator Name,Short definition,Long definition,Source,Topic,Dataset,Periodicity,Aggregation method,General comments
DT.DIS.PRPG.CD,"Disbursements on external debt, private guaranteed by public sector (PPG) (DIS, current US$)","Private sector guaranteed by Public Sector long-term debt are aggregated. Public debt is an external obligation of a public debtor, including the national government, a political subdivision (or an agency of either), and autonomous public bodies. Publicly guaranteed debt is an external obligation of a private debtor that is guaranteed for repayment by a public entity. Disbursements are drawings by the borrower on loan commitments during the year specified. Long-term external debt is defined as debt that has an original or extended maturity of more than one year and that is owed to nonresidents by residents of an economy and repayable in currency, goods, or services. Data are in current U.S. dollars.","Private sector guaranteed by Public Sector long-term debt are aggregated. Public debt is an external obligation of a public debtor, including the national government, a political subdivision (or an agency of either), and autonomous public bodies. Publicly guaranteed debt is an external obligation of a private debtor that is guaranteed for repayment by a public entity. Disbursements are drawings by the borrower on loan commitments during the year specified. Long-term external debt is defined as debt that has an original or extended maturity of more than one year and that is owed to nonresidents by residents of an economy and repayable in currency, goods, or services. Data are in current U.S. dollars.","World Bank, International Debt Statistics.",Economic Policy & Debt: External debt: Disbursements,International Debt Statistics,Annual,Sum,
DT.DIS.DPNG.CD,"Disbursements on external debt, private nonguaranteed (PNG) (DIS, current US$)","Private nonguaranteed external debt is an external obligation of a private debtor that is not guaranteed for repayment by a public entity. Disbursements are drawings by the borrower on loan commitments during the year specified. Long-term external debt is defined as debt that has an original or extended maturity of more than one year and that is owed to nonresidents by residents of an economy and repayable in currency, goods, or services. Data are in current U.S. dollars.","Private nonguaranteed external debt is an external obligation of a private debtor that is not guaranteed for repayment by a public entity. Disbursements are drawings by the borrower on loan commitments during the year specified. Long-term external debt is defined as debt that has an original or extended maturity of more than one year and that is owed to nonresidents by residents of an economy and repayable in currency, goods, or services. Data are in current U.S. dollars.","World Bank, International Debt Statistics.",Economic Policy & Debt: External debt: Disbursements,International Debt Statistics,Annual,Sum,
DT.DIS.DPPG.CD,"Disbursements on external debt, public and publicly guaranteed (PPG) (DIS, current US$)","Public and publicly guaranteed long-term debt are aggregated. Public debt is an external obligation of a public debtor, including the national government, a political subdivision (or an agency of either), and autonomous public bodies. Publicly guaranteed debt is an external obligation of a private debtor that is guaranteed for repayment by a public entity. Disbursements are drawings by the borrower on loan commitments during the year specified. Long-term external debt is defined as debt that has an original or extended maturity of more than one year and that is owed to nonresidents by residents of an economy and repayable in currency, goods, or services. Data are in current U.S. dollars.","Public and publicly guaranteed long-term debt are aggregated. Public debt is an external obligation of a public debtor, including the national government, a political subdivision (or an agency of either), and autonomous public bodies. Publicly guaranteed debt is an external obligation of a private debtor that is guaranteed for repayment by a public entity. Disbursements are drawings by the borrower on loan commitments during the year specified. Long-term external debt is defined as debt that has an original or extended maturity of more than one year and that is owed to nonresidents by residents of an economy and repayable in currency, goods, or services. Data are in current U.S. dollars.","World Bank, International Debt Statistics.",Economic Policy & Debt: External debt: Disbursements,International Debt Statistics,Annual,Sum,
DT.DIS.DEPS.CD,"Disbursements on external debt, public sector (PPG) (DIS, current US$)","Public sector long-term debt are aggregated. Public debt is an external obligation of a public debtor, including the national government, a political subdivision (or an agency of either), and autonomous public bodies. Publicly guaranteed debt is an external obligation of a private debtor that is guaranteed for repayment by a public entity. Disbursements are drawings by the borrower on loan commitments during the year specified. Long-term external debt is defined as debt that has an original or extended maturity of more than one year and that is owed to nonresidents by residents of an economy and repayable in currency, goods, or services. Data are in current U.S. dollars.","Public sector long-term debt are aggregated. Public debt is an external obligation of a public debtor, including the national government, a political subdivision (or an agency of either), and autonomous public bodies. Publicly guaranteed debt is an external obligation of a private debtor that is guaranteed for repayment by a public entity. Disbursements are drawings by the borrower on loan commitments during the year specified. Long-term external debt is defined as debt that has an original or extended maturity of more than one year and that is owed to nonresidents by residents of an economy and repayable in currency, goods, or services. Data are in current U.S. dollars.","World Bank, International Debt Statistics.",Economic Policy & Debt: External debt: Disbursements,International Debt Statistics,Annual,Sum,
DT.NFL.DECB.CD,,"Central bank long-term debt are aggregated. The central bank is the financial institution (or institutions) that exercises control over key aspects of the financial system. The monetary authority, normally the agency that issues currency and holds the country’s international reserves. Net flows (or net lending or net disbursements) received by the borrower during the year are disbursements minus principal repayments. Long-term external debt is defined as debt that has an original or extended maturity of more than one year and that is owed to nonresidents by residents of an economy and repayable in currency, goods, or services. Data are in current U.S. dollars.","Central bank long-term debt are aggregated.  The central bank is the financial institution (or institutions) that exercises control over key aspects of the financial system. The monetary authority, normally the agency that issues currency and holds the country’s international reserves. Net flows (or net lending or net disbursements) received by the borrower during the year are disbursements minus principal repayments. Long-term external debt is defined as debt that has an original or extended maturity of more than one year and that is owed to nonresidents by residents of an economy and repayable in currency, goods, or services. Data are in current U.S. dollars.","World Bank, International Debt Statistics.",Economic Policy & Debt: External debt: Net flows,,Annual,,
DT.NFL.DEGG.CD,"Net flows on external debt, general government sector (PPG) (NFL, current US$)","General government long-term debt are aggregated. Public debt is an external obligation of a public debtor, including the national government, a political subdivision (or an agency of either), and autonomous public bodies. Publicly guaranteed debt is an external obligation of a private debtor that is guaranteed for repayment by a public entity. Net flows (or net lending or net disbursements) received by the borrower during the year are disbursements minus principal repayments. Long-term external debt is defined as debt that has an original or extended maturity of more than one year and that is owed to nonresidents by residents of an economy and repayable in currency, goods, or services. Data are in current U.S. dollars.","General government long-term debt are aggregated. Public debt is an external obligation of a public debtor, including the national government, a political subdivision (or an agency of either), and autonomous public bodies. Publicly guaranteed debt is an external obligation of a private debtor that is guaranteed for repayment by a public entity. Net flows (or net lending or net disbursements) received by the borrower during the year are disbursements minus principal repayments. Long-term external debt is defined as debt that has an original or extended maturity of more than one year and that is owed to nonresidents by residents of an economy and repayable in currency, goods, or services. Data are in current U.S. dollars.","World Bank, International Debt Statistics.",Economic Policy & Debt: External debt: Net flows,International Debt Statistics,Annual,Sum,
DT.NFL.DLXF.CD,"Net flows on external debt, long-term (NFL, current US$)","Net flows (or net lending or net disbursements) received by the borrower during the year are disbursements minus principal repayments. Long-term external debt is defined as debt that has an original or extended maturity of more than one year and that is owed to nonresidents by residents of an economy and repayable in currency, goods, or services. Data are in current U.S. dollars.","Net flows (or net lending or net disbursements) received by the borrower during the year are disbursements minus principal repayments. Long-term external debt is defined as debt that has an original or extended maturity of more than one year and that is owed to nonresidents by residents of an economy and repayable in currency, goods, or services. Data are in current U.S. dollars.","World Bank, International Debt Statistics.",Economic Policy & Debt: External debt: Net flows,International Debt Statistics,Annual,Sum,
DT.NFL.DOPS.CD,"Net flows on external debt, other public sector (PPG) (NFL, current US$)","Other public sector long-term debt are aggregated. Public debt is an external obligation of a public debtor, including the national government, a political subdivision (or an agency of either), and autonomous public bodies. Publicly guaranteed debt is an external obligation of a private debtor that is guaranteed for repayment by a public entity. Net flows (or net lending or net disbursements) received by the borrower during the year are disbursements minus principal repayments. Long-term external debt is defined as debt that has an original or extended maturity of more than one year and that is owed to nonresidents by residents of an economy and repayable in currency, goods, or services. Data are in current U.S. dollars.","Other public sector long-term debt are aggregated. Public debt is an external obligation of a public debtor, including the national government, a political subdivision (or an agency of either), and autonomous public bodies. Publicly guaranteed debt is an external obligation of a private debtor that is guaranteed for repayment by a public entity. Net flows (or net lending or net disbursements) received by the borrower during the year are disbursements minus principal repayments. Long-term external debt is defined as debt that has an original or extended maturity of more than one year and that is owed to nonresidents by residents of an economy and repayable in currency, goods, or services. Data are in current U.S. dollars.","World Bank, International Debt Statistics.",Economic Policy & Debt: External debt: Net flows,International Debt Statistics,Annual,Sum,
DT.NFL.PRPG.CD,"Net flows on external debt, private guaranteed by public sector (PPG) (NFL, current US$)","Private sector guaranteed by Public Sector long-term debt are aggregated. Public debt is an external obligation of a public debtor, including the national government, a political subdivision (or an agency of either), and autonomous public bodies. Publicly guaranteed debt is an external obligation of a private debtor that is guaranteed for repayment by a public entity. Net flows (or net lending or net disbursements) received by the borrower during the year are disbursements minus principal repayments. Long-term external debt is defined as debt that has an original or extended maturity of more than one year and that is owed to nonresidents by residents of an economy and repayable in currency, goods, or services. Data are in current U.S. dollars.","Private sector guaranteed by Public Sector long-term debt are aggregated. Public debt is an external obligation of a public debtor, including the national government, a political subdivision (or an agency of either), and autonomous public bodies. Publicly guaranteed debt is an external obligation of a private debtor that is guaranteed for repayment by a public entity. Net flows (or net lending or net disbursements) received by the borrower during the year are disbursements minus principal repayments. Long-term external debt is defined as debt that has an original or extended maturity of more than one year and that is owed to nonresidents by residents of an economy and repayable in currency, goods, or services. Data are in current U.S. dollars.","World Bank, International Debt Statistics.",Economic Policy & Debt: External debt: Net flows,International Debt Statistics,Annual,Sum,
DT.NFL.DPNG.CD,"Net flows on external debt, private nonguaranteed (PNG) (NFL, current US$)","Private nonguaranteed external debt is an external obligation of a private debtor that is not guaranteed for repayment by a public entity. Net flows (or net lending or net disbursements) received by the borrower during the year are disbursements minus principal repayments. Long-term external debt is defined as debt that has an original or extended maturity of more than one year and that is owed to nonresidents by residents of an economy and repayable in currency, goods, or services. Data are in current U.S. dollars.","Private nonguaranteed external debt is an external obligation of a private debtor that is not guaranteed for repayment by a public entity. Net flows (or net lending or net disbursements) received by the borrower during the year are disbursements minus principal repayments. Long-term external debt is defined as debt that has an original or extended maturity of more than one year and that is owed to nonresidents by residents of an economy and repayable in currency, goods, or services. Data are in current U.S. dollars.","World Bank, International Debt Statistics.",Economic Policy & Debt: External debt: Net flows,International Debt Statistics,Annual,Sum,
DT.NFL.DPPG.CD,"Net flows on external debt, public and publicly guaranteed (PPG) (NFL, current US$)","Public and publicly guaranteed long-term debt are aggregated. Public debt is an external obligation of a public debtor, including the national government, a political subdivision (or an agency of either), and autonomous public bodies. Publicly guaranteed debt is an external obligation of a private debtor that is guaranteed for repayment by a public entity. Net flows (or net lending or net disbursements) received by the borrower during the year are disbursements minus principal repayments. Long-term external debt is defined as debt that has an original or extended maturity of more than one year and that is owed to nonresidents by residents of an economy and repayable in currency, goods, or services. Data are in current U.S. dollars.","Public and publicly guaranteed long-term debt are aggregated. Public debt is an external obligation of a public debtor, including the national government, a political subdivision (or an agency of either), and autonomous public bodies. Publicly guaranteed debt is an external obligation of a private debtor that is guaranteed for repayment by a public entity. Net flows (or net lending or net disbursements) received by the borrower during the year are disbursements minus principal repayments. Long-term external debt is defined as debt that has an original or extended maturity of more than one year and that is owed to nonresidents by residents of an economy and repayable in currency, goods, or services. Data are in current U.S. dollars.","World Bank, International Debt Statistics.",Economic Policy & Debt: External debt: Net flows,International Debt Statistics,Annual,Sum,
DT.NFL.DEPS.CD,"Net flows on external debt, public sector (PPG) (NFL, current US$)","Public sector long-term debt are aggregated. Public debt is an external obligation of a public debtor, including the national government, a political subdivision (or an agency of either), and autonomous public bodies. Publicly guaranteed debt is an external obligation of a private debtor that is guaranteed for repayment by a public entity. Net flows (or net lending or net disbursements) received by the borrower during the year are disbursements minus principal repayments. Long-term external debt is defined as debt that has an original or extended maturity of more than one year and that is owed to nonresidents by residents of an economy and repayable in currency, goods, or services. Data are in current U.S. dollars.","Public sector long-term debt are aggregated. Public debt is an external obligation of a public debtor, including the national government, a political subdivision (or an agency of either), and autonomous public bodies. Publicly guaranteed debt is an external obligation of a private debtor that is guaranteed for repayment by a public entity. Net flows (or net lending or net disbursements) received by the borrower during the year are disbursements minus principal repayments. Long-term external debt is defined as debt that has an original or extended maturity of more than one year and that is owed to nonresidents by residents of an economy and repayable in currency, goods, or services. Data are in current U.S. dollars.","World Bank, International Debt Statistics.",Economic Policy & Debt: External debt: Net flows,International Debt Statistics,Annual,Sum,
DT.NFL.DSTC.CD,"Net flows on external debt, short-term (NFL, current US$)",Net flows (or net lending or net disbursements) received by the borrower during the year are disbursements minus principal repayments. Short-term external debt is defined as debt that has an original maturity of one year or less. Available data permit no distinction between public and private nonguaranteed short-term debt. Data are in current U.S. dollars.,Net flows (or net lending or net disbursements) received by the borrower during the year are disbursements minus principal repayments. Short-term external debt is defined as debt that has an original maturity of one year or less. Available data permit no distinction between public and private nonguaranteed short-term debt. Data are in current U.S. dollars.,"World Bank, International Debt Statistics.",Economic Policy & Debt: External debt: Net flows,International Debt Statistics,Annual,Sum,
DT.NFL.DECT.CD,"Net flows on external debt, total (NFL, current US$)","Net flows on external debt are disbursements on long-term external debt and IMF purchases minus principal repayments on long-term external debt and IMF repurchases up to 1984. Beginning in 1985 this line includes the change in stock of short-term debt (including interest arrears for long-term debt). Thus, if the change in stock is positive, a disbursement is assumed to have taken place; if negative, a repayment is assumed to have taken place. Long-term external debt is defined as debt that has an original or extended maturity of more than one year and that is owed to nonresidents by residents of an economy and repayable in currency, goods, or services. Data are in current U.S. dollars.","Net flows on external debt are disbursements on long-term external debt and IMF purchases minus principal repayments on long-term external debt and IMF repurchases up to 1984. Beginning in 1985 this line includes the change in stock of short-term debt (including interest arrears for long-term debt). Thus, if the change in stock is positive, a disbursement is assumed to have taken place; if negative, a repayment is assumed to have taken place. Long-term external debt is defined as debt that has an original or extended maturity of more than one year and that is owed to nonresidents by residents of an economy and repayable in currency, goods, or services. Data are in current U.S. dollars.","World Bank, International Debt Statistics.",Economic Policy & Debt: External debt: Net flows,International Debt Statistics,Annual,Sum,
DT.DOD.PVLX.CD,Present value of external debt (current US$),"Present value of debt is the sum of short-term external debt plus the discounted sum of total debt service payments due on public, publicly guaranteed, and private nonguaranteed long-term external debt over the life of existing loans. This calculation assumes that the PV of loans with a negative grant element is equal to the nominal value of the loan.
Data are in current U.S. dollars.","Present value of debt is the sum of short-term external debt plus the discounted sum of total debt service payments due on public, publicly guaranteed, and private nonguaranteed long-term external debt over the life of existing loans. This calculation assumes that the PV of loans with a negative grant element is equal to the nominal value of the loan.
Data are in current U.S. dollars.","World Bank, International Debt Statistics.",Economic Policy & Debt: External debt: Debt outstanding,International Debt Statistics,Annual,Sum,
DT.AXF.DPPG.CD,Principal forgiven (current US$),"Principal forgiven is the amount of principal due or in arrears that was written off or forgiven in any given year. It includes debt forgiven within and outside Paris Club agreements, principal forgiven and principal arrears forgiven. Data are in current U.S. dollars.","Principal forgiven is the amount of principal due or in arrears that was written off or forgiven in any given year. It includes debt forgiven within and outside Paris Club agreements, principal forgiven and principal arrears forgiven. Data are in current U.S. dollars.","World Bank, International Debt Statistics.","Economic Policy & Debt: External debt: Arrears, reschedulings, etc.",International Debt Statistics,Annual,Sum,
DT.AMT.DECB.CD,,"Central bank  long-term debt are aggregated. The central bank is the financial institution (or institutions) that exercises control over key aspects of the financial system. The monetary authority, normally the agency that issues currency and holds the country’s international reserves. Principal repayments are actual amounts of principal (amortization) paid by the borrower in currency, goods, or services in the year specified. Long-term external debt is defined as debt that has an original or extended maturity of more than one year and that is owed to nonresidents by residents of an economy and repayable in currency, goods, or services. Data are in current U.S. dollars.","Central bank  long-term debt are aggregated. The central bank is the financial institution (or institutions) that exercises control over key aspects of the financial system. The monetary authority, normally the agency that issues currency and holds the country’s international reserves.  Principal repayments are actual amounts of principal (amortization) paid by the borrower in currency, goods, or services in the year specified. Long-term external debt is defined as debt that has an original or extended maturity of more than one year and that is owed to nonresidents by residents of an economy and repayable in currency, goods, or services. Data are in current U.S. dollars.","World Bank, International Debt Statistics.",Economic Policy & Debt: External debt: Amortization,,Annual,,
